"Jayson Werth","1327","Werth, who will be 38 years old in 2017, put his injury-shortened 2015 behind him on his way to 606 plate appearances in 2016. This is perhaps the most telling detail of Werth's '16 campaign, as he showed that, not only can he be a source of serviceable production as he ages, but he can also stay on the field (if needed) long enough to be serviceable. The power isn't what it once was (he probably isn't topping isolated powers over .200 again), but he still hits the ball hard, as evidenced by his 36% hard-hit rate. He popped 21 home runs last year and should continue to be a cheap source of power. Right now, he appears in line for the Nationals' left field job, with Michael Taylor and Clint Robinson on the bench, and he could manage a full season of playing time again. I wouldn't bet on it, however, as the Nationals have plenty of reason to try to keep him healthy for their likely playoff run. Plus, after acquiring Adam Eaton, left field is one of the few positions the team could continue to upgrade at. Expect another season similar to '16, as Werth should clear 15 home runs with a .250 AVG, though it may come in 500 plate appearances. (Joe Douglas)","Though he may not put up another 600-PA season in 2017, Werth should once again be a solid source of power available in the later rounds of your fantasy draft."," Werth (knee) will bat second in the order and man left field in Monday's Grapefruit League game against the Yankees, Chelsea Janes of The Washington Post reports. (3/20/2017)"
"John Jaso","5887","Jaso is one of those players who possesses an unfortunate combination of merely decent hitting skills and no natural position. He used to be a catcher, but concussions pushed him to a safer realm - namely first base. Unfortunately, his moderate average, high on-base percentage, and low power profile isn't a classic fit at first base, and it especially doesn't work well in this age of almighty power. The Pirates have a lot of weird corner infield depth to juggle in 2017. It'll be interesting to see how Jaso fits into the puzzle. He'd work better on an American League club where he could take 250 plate appearances split between first base and designated hitter. Perhaps a trade awaits. (Brad Johnson)","Can you read John Jaso's name without answering "Jingleheimerschmidt?" Ha! Now it's in your head. John Jaso Jingheimerschmidt, his name is my name too..."," Jaso went 2-for-3 with a home run, two walks, two RBI and two runs in Sunday's 10-4 loss to the Cardinals. (10/3/2016)"
"David Peralta","2136","Count David Peralta among a number of things that the Arizona Diamondbacks expected would go much better in 2016. After a 2015 season in which he slashed .312/.371/.522/.893, Peralta saw a rather large dip in production in 2016. Of course, the large part of that was due to injury, as Peralta book-ended the season with wrist problems, with surgery in August bringing an official end to his season after just 171 plate appearances. With that in mind, it comes as no surprise that he experienced a drop in power, with his isolated power declining from .210 to .181, with a four homer season following up 17 in '15. A notably aggressive hitter, Peralta walked at a rate of just 4.4% and saw a rise in his strikeout rate, which grew to 23.0%. Also not working in his favor was a batting average on balls in play that dropped from .368 in 2015 to just .310 in 2016. In his two seasons prior to 2016, he demonstrated an ability to be aggressive but still maintain a solid contact rate. Should that trend continue, his ability to generate power should return if he's healthy in 2017, making him a viable option in the Arizona outfield. (Randy Holt)","After strong showings in 2014 and 2015, the Arizona Diamondbacks had high hopes for David Peralta before wrist injuries proved to be his demise. He'll aim to rebound in several respects with a healthy 2017."," Peralta hit his first homer of the spring Thursday against the Brewers, pushing his spring line to .290/.324/.452 through 11 games. (3/17/2017)"
"Ryan Zimmerman","4220","Ryan Zimmerman is in a four-year freefall in Wins Above Replacement, hitting a career and nearly an MLB-low of -1.3 wins in 2016. Health is Zimmerman's No. 1 issue. A shoulder injury forced him to move from third base to first base, and Zimmerman has also dealt with plantar fasciitis, an oblique injury, and a wrist injury from a hit-by-pitch just in the last several seasons. His 115 games and 467 plate appearances in 2016 were three-year highs, and given his declining offensive production, there is little reason to take a gamble that next year will be his first fully-healthy one since 2013. At his best, Zimmerman contributed with a good batting average, moderate power, and the other counting stats that came from hitting in the heart of a productive order. Following the team's additions of Adam Eaton and Trea Turner over the last calendar year, Zimmerman has likely become a bottom-of-the-order hitter, erasing his runs and RBI potential. The power is still there. Zimmerman has hit 31 home runs over the last two seasons in just 857 total plate appearances. And his declining batting averages appear driven more by declining batting averages on balls in play than profiles changes in his pull rate and hard contact rate, so some rebound is possible. Still, that difference is the profile difference between Zimmerman being the new Ryan Howard or a less healthy Mitch Moreland. Neither is the recipe for fantasy success. (Scott Spratt)","Injuries have robbed Ryan Zimmerman of a once-promising career. Now, his risk of missed time is too great to take a gamble on his moderate power potential and possible batting average recovery with better luck on his balls in play."," Zimmerman went 3-for-3 with a walk, a double, his first spring home run, three runs scored and two RBI in Sunday's Grapefruit League game against the Marlins. (3/20/2017)"
"Jorge Soler","14221","Injuries limited Jorge Soler to just 264 plate appearances in 2016, though the potential is still there for him to be an impactful offensive player in the future. The results were largely mediocre as he hit just .238 and struck out 25% of the time. However, Soler's upside in the power game has always made him an intriguing quantity, and he did flash more of that. His isolated power came in at .198 as he hit an even dozen home runs. There's something of an approach there as well, as he walked 11.7% of the time. At the very least, his park-adjusted offense painted him at 6% above league average as an offensive player, which is encouraging. For Soler, it's about continuing to refine that approach and make more consistent contact. His Contact% in each of the last two seasons has fallen under 70% and he posted a SwStr% of 14.2 in 2016, which was actually lower than the previous season. We know he possesses immense power, it's just a matter of making the contact in order to consistently demonstrate that. He'll have a chance to thrive in Kansas City where he'll have an opportunity to grab some outfield time or serve as a designated hitter. Either outcome will lead to some consistency in his plate appearances. (Randy Holt)","Jorge Soler turned in something of a disappointing year in 2016, as he hit only .238 across 264 plate appearances. There were some positives, though, including an ISO of .198 and a wRC+ of 106, indicating that an increased role in Kansas City could help to establish him as a major offensive threat in the future."," Soler went 0-for-2 against the Cubs on Wednesday and is now 0-for-8 with two walks through four spring games. "They're just getting their timing down," manager Ned Yost told the Kansas City Star. "I don't really think too much about it until about the halfway point." (3/2/2017)"
"Chris Parmelee","2554","Parmelee has an .895 OPS at Triple-A in 887 plate appearances, but just a .707 in 1003 PA at the major league level with Minnesota and Baltimore. And the only reason he's north of .700 is because of 1.035 in his 88 PA debut all the way back in 2011. He has a high of .691 in the four seasons since. Parmelee had been hitting well in Triple-A Norfolk (.830 OPS) before breaking his arm on a hit by pitch which ended his season in mid-August and likely cost him a September call-up with the Orioles. By the way, that was probably the right organization (and home park) or him to try and spark something for his career given what they'd done with retreads like Lew Ford, Nate McLouth, Steve Pearce, and Jimmy Paredes. Alas, he has opted for free agency and should get at least a Spring Training invite somewhere.(","Parmelee is currently filling that Quad-A/26th-man role as he isn't quite good enough to be a bench bat, but if a corner outfielder or first baseman goes down, he can fill-in for a couple weeks. At 28 years old, he's unlikely to develop into much more than this role."," Parmelee smacked a solo home run in his only at-bat during Monday's 3-1 Cactus League loss to the Reds. (3/14/2017)"
"Max Kepler","12144","Kepler's jump to the big leagues has been amazing considering he was completely helpless against left-handed pitchers in Low-A ball in 2013 and not terribly impressive in High-A (.726 overall on-base plus slugging) the year after that. But 2015 was the year of the German, as Kepler captured the Southern League MVP Award over equally-impressive prospect Orlando Arcia with a .947 OPS for the league champion Chattanooga Lookouts. He parlayed that into a big-league cup of coffee at the end of 2015 and completed the jump with 113 MLB games in 2016. The overall numbers aren't terribly impressive a .235/.309/.424 slash line but Kepler went on a stretch in the middle of the season that showed what he's truly capable of. Kepler hit a walk-off home run against Boston's Matt Barnes in mid-June, and over the next 50 games hit a scorching .272/.354/.571. With that said, Kepler batted .207/.255/.283 in September and still has issues with lefties at times (.595 OPS), but there's plenty to like here. Given his ability to adjust as he acclimates to levels especially in the high minors he should be a solid fantasy factor this season. At his peak, he should hit 25 home runs with a .280-.300 batting average and maybe a dozen steals. You can find room for a guy like that, right? (@Brandon_Warne)","Kepler is on the upswing and could be a fantasy factor as soon as this season. Now is the time to get in on the ground floor."," Kepler (finger) is scheduled to play in Monday's Grapefruit League game against the Blue Jays, LaVelle Neal of the Minneapolis Star Tribune reports. (3/19/2017)"
"Joe Mauer","1857","Mauer showed glimpses that there was still a good player inside a formerly concussed man's body in 2016, even if his final hitting line .261/.363/.389 looked like a poor man's John Olerud rather than the Mauer of yore. It was a particularly cruel season in that respect, as Mauer's body gave out on him in Atlanta late in the season while he was attempting to score on a double in mid-August. He screwed up his quadriceps and hit just .154/.267/.256 after that series before basically missing the final two weeks of the season. Before he got hurt, Mauer was hitting a respectable .281/.381/.413. What 2016 proved is that Mauer can still be an effective hitter, but that manager Paul Molitor needs to use him more sparingly. To that end, he's probably not much of a fantasy consideration anymore. Of course, that bridge was crossed after 2013, when he was no longer a catcher and his productivity took a huge hit across the board. It is a shame, as he hit the most home runs he'd hit in a season since his aberrant 2009 MVP campaign and has started to look pretty good defensively at first base, too. There are plenty of options to help curb his playing time in 2017, if Molitor chooses to do so. (@Brandon_Warne)","Mauer will most likely only be viable in the major leagues as a part-timer moving forward say, 100-120 games and that just won't work at first base in fantasy leagues."," Twins manager Paul Molitor would like to reduce Mauer's workload this season to keep him healthier. "I think I overplayed Joe the first half," Molitor told ESPN 1500 AM Twin Cities. "I think it resulted in maybe leading to a potential injury as well as maybe the downslide of performance near the end of the season." (2/20/2017)"
"Alex Dickerson","12649","There might not be a more excitingly nebulous outfield in the majors than the Padres'. Flush with young talent, upside abounds in San Diego. There are four potential young starting outfielders fighting for playing time who've combined for a total of 741 career plate appearances. Dickerson's 285 were some of the most exciting. In the minors, Dickerson posted middling walk rates but also limited his strikeouts while hitting for impressive power. In the majors last season, he walked in 9% of his plate appearances while also striking out at one of the lowest rates of his career. He ranked on the better side of league average by most plate discipline metrics, boding well for his transition to the majors. And he also hit for the power we'd expect, going yard 10 times on the way to a .198 isolated slugging percentage. Most impressively, he managed to hit for power while also limiting his swinging-strike rate to just 8%, two points better than the league average. I'm very bullish on Dickerson's abilities in 2017. It's simply a question of playing time. His lack of defensive ability relegates him to a corner outfield spot. It's conceivable he picks up additional plate appearances spelling the oft-injured Wil Myers at first or DHing in interleague games. Still, he finds himself part of a talented and fluid outfield in San Diego, and defense matters. (Rylan Edwards) ","Draft Dickerson with the expectation that if he starts, he'll hit. But keep an eye on his playing time in spring training. He's a talented player who you'll want on your team so long as he's playing often enough to produce."," Dickerson was diagnosed with a disc protrusion in his back, Dennis Lin of the San Diego Union-Tribune reports. The outfielder won't require surgery, but he will miss 3-4 weeks. (3/16/2017)"
"Stephen Piscotty","13367","Stephen Piscotty had a good first half, where he hit .295 with 11 homers and hit 30% better than the average player offensively. In the second half his average dropped to .247, and it wasn't just some bad luck. His strikeout rate went from 17% to 24% and his walk rate went from 9% to 6.5% indicating the struggle was real for Piscotty. He did manage to double his home runs in the second half, keeping his overall numbers on offense close to average. His line on the season ended up pretty good with 22 homers, 80+ RBI and runs and a .273 batting average. For the 26-year-old coming off his first full season in the majors, it is fair to think a repeat of those numbers is possible. Piscotty did also steal seven bases, but was caught five times so it isn't clear how many opportunities he will have going forward. Piscotty is entrenched in right field for the Cardinals, and he figures to hit in an important spot in the lineup, potentially cleanup, providing him with ample RBI opportunities. There is a chance that his second half numbers carry over and he's a low-average, 20-homer guy, and that seems about as likely as him finding 30-homer power with a .300 average. Odds are, he'll be somewhere in between. (Craig Edwards)","Piscotty had a solid first half with a disappointing second. Expect a more consistent performance this season with roughly the same overall batting line, but with more opportunities to drive in runs."," Piscotty went 1-for-2 with an RBI double, a walk and two runs in Monday's 6-3 Grapefruit League victory over the Astros. (3/14/2017)"
"Hunter Pence","8252","Pence has been a model of consistency throughout his 10-year career, topping 640 plate appearances and 20 homers in consecutive seasons from 2008-2014 with a .280 average during that span. He probably would have done the same thing in 2015-2016 too if not for a broken forearm and a hamstring injury that forced him to miss time. While the injuries are concerning (the forearm seemed somewhat fluky but hamstring injuries can linger), Pence isn't getting any younger, and he appears to have a clean bill of health as we enter 2017. While he could present a profit if discounted because of his injuries from the past two seasons, there is one note of caution. Over the past two years, Pence has made about 5% less contact than he had in prior seasons (which may help explain his light rise in strikeouts). Expect Pence to do something similar to what he has done in the past. He should be healthy, top 650 plate appearances, a .275 AVG, 20 home runs, and 80 runs and RBI. For those playing in Ottoneu leagues, group Pence in with the tier of Adam Eaton, Kole Calhoun, and Stephen Piscotty. Outfielders whose per-game or plate-appearance numbers are good but unspectacular, but they accrue enough plate appearances to be vaulted into a higher tier. (Joe Douglas)","After seven straight seasons of notching over 640 plate appearances, Pence was injured again in 2016. While he appears to be healthy going into 2017, he is now 34 years old, and one could wonder when age will catch up with him. However, he remains a consistent source of production, likely to put up a 275 average, 20 homers, 80 runs, and 80 RBI over a full season."," Pence has struggled at the plate this spring (2-for-20), but he stole his first base during exhibition play in Saturday's split-squad loss to the Diamondbacks. (3/12/2017)"
"Carlos Beltran","589","If Beltran keeps hitting the way he hit in 2016, the discussion regarding his Hall of Fame chances will shift from "if" to "when." After three years of faring relatively poorly against southpaws, he punished them last year, fully reviving the idea that he's still a plenty-effective full-time hitter. A jam-packed outfield situation in Houston will allow him to enjoy the perks of being a designated hitter; the extra rest, one might think, could help stave off injury and keep the dreaded aging curve at bay a bit longer. In light of the league-wide power surge, it's difficult to determine the legitimacy of many home run outputs, including Beltran's. Given his age and history, a return to a more modest home run rate seems predestined, although I doubt anyone feels entitled to a repeat. His type comes a dime a dozen nowadays, but 20 home runs and a .270 batting average gets the job done, even in standard formats. There may be safer options, but the Astros' potent lineup should bolster his stock. He's a fringe top-50 outfielder. (Alex Chamberlain)","Beltran, 39, just posted his fifth OPS above .800 in the last six years. The power should slip back to its more recent levels, but his anticipated role as Houston's designated hitter should help keep him fresh. He's a fringe starting outfielder in standard formats, and Houston's potent lineup should prop him up."," Beltran went 1-for-3 with a home run in Saturday's game against the Mets. (3/5/2017)"
"Tom Murphy","13499","When I asked people about Murphy, the first response was to emphasize how jacked he is. I didn't want to be left out, so there it is! Murphy is an offensive-minded catcher with enough defensive skills to be around average in the field. How much he hits will be determined by how much he improves his approach. He carries some risk of being a low-average, moderate-power catcher due to some strikeout concerns, but he may just hit for enough power that it won't matter. Murphy has a compact swing with a nice fly ball path, and he has the strength to turn those fly balls into a lot of homers. His shoulders can get stiff during his swing, resulting in his hands pushing out in front, making him slightly less dangerous pitches down in the zone. It also makes his power mostly pull-dominant, though it's not like there isn't a precedent for a guy with tight shoulders swinging the bat alright. (Dan Farnsworth)","With a 50+ grade on his throwing and slightly below-average receiving and blocking, Murphy's offense will be the key to his future as a regular. The strikeouts are likely here to stay. The power is real, which will have to help him maintain decent walk rates to become a reliable starter."," Murphy will miss 4-to-6 weeks with a hairline fracture of his right forearm, MLB.com's Thomas Harding reports. (3/14/2017)"
"Jason Kipnis","9776","After his home run total fell into the single digits over the previous two seasons, Kipnis powered up, helping contribute to the leaguewide spike. While its doubtful he could hold onto those gains, part of the jump was due to a career high fly ball rate. That's simply a change in approach, as he had consistently posted FB% marks in the low 30% range, before boosting that to his 2016 mark of 37.4%. Whether he sustains those FB% gains or not will determine whether his home run total drops back into the low teens or continues to flirt with the 20 level. His BABIP has also bounced around, but with a high line drive rate, low pop-up rate, power, and speed, he looks like a legit high BABIP guy, with his two sub-.300 marks smelling fluky. Although he'll turn 30 at the beginning of the season, he should remain an all-around fantasy contributor.(","Kipnis turned career high fly ball and HR/FB rates into his first 20-homer season, but requiring two career bests means it likely won't last. Still, even if his homer total drops back into the teens, he does enough everywhere else to be a strong fantasy contributor."," Kipnis (shoulder) will resume hitting and throwing in a week and is expected to be four to five weeks from returning to game action. (3/19/2017)"
"Adam Jones","6368","Despite a frighteningly low walk rate (4.5% BB% for his career), Adam Jones continues to be a consistent source of power and R/RBIs for the Orioles. After years of being a .280 hitter, though, Jones' average has slipped recently, and a interseason slump appears to be to blame: between August of 2015 and last May, Jones hit .231/.275/.394 with a .256 BABIP, driven by spikes in his strikeout and groundball rates. After June 1st, Jones went .277/.317/.466 -- though the turnaround was good to see, of course, it's still a sign of how things could change but is still a sign of how things could change if/when Jones' batting profile falls apart. Even so, a 30/.280 season from Jones looks like a reasonable possibility for 2017. The steals aren't coming back, but if he hits those marks and bats high enough in the lineup to fill the rest of his counting stats, he would definitely provide a solid ROI in his current draft range near the back of the top 30 outfielders. Just remember that things could go south very quickly. (Brice Russ)","Jones bounced back from an early-season slump in 2016, and (though his floor is lower than it seems) seems likely to perform as a top-25 OF or better this year."," Jones, who hit from the leadoff spot in 73 percent of his at-bats last season, will move down in the batting order this year, Roch Kubatko of MASN Sports reports. (3/9/2017)"
"Brandon Moss","4467","Heading into September last year, it appeared that Brandon Moss was well on his way to a multi-year contract, or at least a qualifying offer. Through August, Moss had hit 25 homers in just 363 plate appearances and his overall batting line was 34% better than league average. Then September happened. Moss came to bat 101 times in the final month of the season and he got just nine hits and struck out 33 times. That month tanked his season stats, bringing his batting average down to .225 and kept him from getting to 30 homers. The left-handed Moss is probably best served in a platoon role and not playing every day like the Cardinals tried to do the second half of last season. While not great defensively, Moss can play both corners in the outfield as well as first base and has some positional versatility. Playing mostly against right-handers and getting a decent amount of rest for the 33-year-old with a history of hip problems (he also missed time last year with an ankle injury) would probably serve to help Moss' performance in the future. Give him 500 plate appearances and he can probably hit 25 homers. He's going to strike out a bunch and have a low average, but it might be worth the trade-off if you can spot his starts. (Craig Edwards)","Moss' September crash hurt his seasonal numbers, but in a platoon role, 25 homers is still a decent possibility for the veteran."," Moss will DH in Wednesday's game against Team Venezuela, his first action since being scratched with a stiff lower back, Rustin Dodd of the Kansas City Star reports. (3/8/2017)"
