"Matt Bush","1246","You are probably most familiar with Bush for his off-the-field issues as he went from the height of #1 overall pick to rock bottom when he served 51 months in prison for a DUI accident that included him running someone over. That he even pitched in the majors in 2016 is something, let alone the fact that he was quite good in 61.7 innings. For some, the off-the-field stuff will always be who he is, but it doesn't diminish the mistakes he made to acknowledge that he has done something incredible to get his career back on track. This isn't the best space to fully dive into this, but simply focusing on his 25 percent strikeout rate and mentioning how he has a real chance at usurping Sam Dyson for the closer's role in Texas likely would've been critiqued as glossing over his past. The 31-year old righty had the ninth-hardest fastball among relievers at 97.0 MPH and he backs it up with a pair of strong breaking balls. All three pitches generate swings and misses suggested growth potential for his strikeout rate. If there's opportunity, he could be closing at some point in 2017. (","Bush's debut came with a rise from a host of self-imposed huge mistakes, but it doesn't minimize that trouble to recognize that there is some positivity in this story. Instead of staying on the very dark path of his 20s, he has rejuvenated his career and now shows promise as an impact player for the Rangers. At worst, he will be a key setup man for team, making him a viable low-dollar option in AL-only leagues.","N/A"
"Mychal Givens","10430","After the Orioles called up the former shortstop in late June, Givens was lights out as a reliever. His strikeout minus walk rate (27.4%) was the eighth-best among all relievers (minimum 20 innings pitched). He posted a 1.80 ERA with the ERA estimators to match. Additionally, he only allowed 0.3 homers per nine, which agreed with his minor league home run rates. He does have a couple of factors working against him. First, he throws from a sidearm slot and lefties could easily pick up his pitches and hit them with some authority with added looks. Maybe this will be mitigated by the fact that Givens holds the balls upright, giving him the movement of a more over the top pitcher. Also working against Givens' fantasy value is the fact that the Baltimore bullpen is stacked with Zack Britton as the closer and Brian Matusz and Darren O'Day ahead of him. If he somehow ends up with the closer's role this season, I see no reason he won't excel at the job. (Jeff Zimmerman)","Mychal Givens could be an elite reliever. The only thing holding his value down is the distance he is away from being a closer."," Givens pitched one inning, allowing two runs on three hits while striking out three in Friday's WBC opener for Team USA against Columbia. (3/11/2017)"
"Derek Law","13133","With two good breaking balls and excellent command, Law had a very impressive rookie season. Amassing a 1.1 WAR in 55 innings pitched is a solid ratio, and Law will be counted on by the Giants as one of their top middle relief options. After signing Mark Melancon, the closer spot is locked in barring injury, but Law could be one of the first options if Melancon did get hurt. It is difficult to put together a 4.2% walk rate while throwing breaking balls over 40% of the time, but Law's quietly impressive debut looks legitimate when considering his pitch mix, command, and decent strikeout rate. He is unlikely to ever be overpowering, but guys like Law are essential for competitive clubs over the course of a full season. Unfortunately, he is not essential for fantasy squads unless you are playing in a holds league. Hunter Strickland may be the first handcuff option to start the year, but Law was better last season so that is far from certain.","Law had a nice debut and has set himself up to be either the seventh or eighth inning guy for what should be a competitive ballclub. The only chance he would get saves is if Mark Melancon goes down with injury, but pitchers get hurt all of the time and Law could be a very cheap but solid handcuff option."," Law is expected to fall in either a seventh or eighth inning role to start the season, CSN Bay Area reports. (2/8/2017)"
"Rich Hill","4806","Take a sidearming reliever who can't stay healthy, push his arm slot back over the top, make him throw the high-spin curveball as much as his high-spin rising four-seam fastball, and you've got... an ace who can't stay healthy. Last year's 111 innings was a high-water mark for Hill since the only other time he threw more than 100 innings (195 in 2007), so the injuries are part of the package. But 100 innings of excellent, excellent pitching have a lot of value. That's why he's back in Los Angeles on a three-year deal. Now fantasy owners have to feel the same way that real-life owners do: love him while he's in, and factor in injury when you project him. The 145 innings the 37-year-old is getting from our depth charts at the time of this writeup seem optimistic considering he's only thrown that many once in his career, and that was a long time ago. I'd pay for 100 innings, which means I might not own him a ton. I do appreciate him, though. He's very good. (Eno Sarris)","Just don't forget that 100 innings is a good outcome from Hill, healthwise, when you get all excited on draft day. Teams with many disabled list slots and good talent on the wire may want to pay the going price for Hill and use the wire to supplement during his injury stints. Everybody else -- be careful."," Hill held the Reds to one run (zero earned) on one hit while walking three and striking out three in Tuesday's spring training win. (3/14/2017)"
"Steven Matz","13361","Sometimes forgotten because of the star power the Mets have at the top of their rotation, Steven Matz proved he belonged in that potentially elite rotation and at the top of fantasy draft lists with an excellent 2016 season. In fact, Matz's 8.8 strikeouts and 2.1 walks per nine were both a tick better than his teammate's Jacob deGrom, even if his ERA was a touch worse thanks to an inflated home run per flyball rate. Unfortunately for Matz, there was another thing he has in common with his teammate deGrom in 2016, which was elbow surgery. In October, he had a procedure to remove bone spurs in his pitching elbow, and while, like deGrom, Matz's prognosis is good for the start of the 2017 season, Matz does not have the same track record of healthy major league innings to assuage concerns. In fact, Matz has never thrown 150 innings in a professional season, and that leads me to speculate that he will be on a pitch count that could restrict him to 170-180 innings in 2017 even if he remains healthy. Matz should perform like a top 30 starter when he starts, but injury concerns and the potential for an innings cap should push him down to a ranking in the 40s among starting pitchers. (Scott Spratt)","Steven Matz put up very similar strikeout and walk numbers to his teammate and fantasy darling Jacob deGrom in 2016, but also like deGrom, he needed elbow surgery late in the season. Matz's surgery was to remove bone spurs in his pitching elbow, and while he is expected to be fully recovered for the start of the 2017 season, injury concerns and a potential innings cap will dampen his fantasy value from what it otherwise would be given his excellent peripheral numbers."," Matz has been scratched from his scheduled Grapefruit League start Monday with elbow discomfort, David Lennon of Newsday reports. (3/26/2017)"
"Chaz Roe","9866","Now with the Braves, Roe is on his fourth team over the past four seasons. He has been wildly inconsistent, and placing a value on him is tough. Here is what we do know about the 30-year-old. He strikes out a decent number of batters with a career 9.7 K's per nine innings. He walks quite a few as well, however, with a career 4.4 walks per nine. His ERA has hovered around 4.00, which is unusable as a closer. Even with the subpar performance, he could be in line for saves in a weak Braves bullpen after some late-season changes. With Atlanta, he began throwing his slider 60% of the time, which lowered his FIP down to 1.75. Even though he still had a 3.60 ERA, some real signs of improvement began to stick. The main improvement is a career-high strikeout rate (11.7 K/9) and low walk rate (3.2 BB/9). Those metrics are similar to those of Cody Allen, Hector Neris, and Tyler Thornburg. Don't be surprised if Roe gets some saves, but he'll likely morph back into his useless self. (Jeff Zimmerman)","After being traded to Atlanta, Roe made some changes which could potentially put him in line for saves."," Roe will compete for a spot in the Braves' bullpen this spring. (2/2/2017)"
"Jerry Blevins","7841","After missing most of 2015 with a fractured arm, Blevins signed a one-year deal to rejoin the Mets in 2016. Jerry Blevins was not a true LOOGY last year -- he averaged nearly 0.2 IP in his 73 appearances, and about 40% of the batters he faced were righties. In a way, this makes his 2.79 ERA even more impressive; though it was supported by a pretty high 82% strand rate, Blevins' 11.1 K/9 and 11% swinging strike rate show that he can still make bats miss even as his fastball velocity sinks into the high-80s. Perhaps more relevant for fantasy purposes, Blevins collected 16 holds (second-most among all Mets relievers) and 2 saves last year. Blevins re-upped with the Mets in the offseason and looks to reprise his lefty specialist role; there's not much upside here, but he should contribute decent ratios and a smattering of holds in particularly deep leagues. (Brice Russ)","After an injury-riddled 2015, Blevins had a solid comeback in 2016. He'll be rosterable in very deep leagues if he keeps it up this year."," Blevins walked the only batter he faced, Matt Carpenter, on four pitches during Saturday's Grapefruit League game against the Cardinals. (3/19/2017)"
"Pedro Baez","5420","On the surface, Baez looks like a really good reliever who could, one day, become a closer. He doesn't walk a lot of hitters, strikes out a lot and has elite velocity. But once you dive deeper into the numbers, it gets ugly. Baez had a the 20th-worst HR/FB rate and has poor command in the strike zone. Often, his fastball leaks out over the plate and it gets hammered. Major League hitters will catch up to velocity, no matter how hard a pitcher throws. He was better when he came back from a brief stint in the minors. While in Oklahoma City, he learned the term "slow the game down," didn't literally mean "slow the game down." Baez thought that and had an MLB-high 30.2-second pace. He was given the moniker, "The Human Rain Delay," because of this. Baez doesn't have a lot of fantasy value because Kenley Jansen gobbles up all the saves in Los Angeles. And even if Jansen didn't, Baez isn't the next in line to get that chance.If he can harness his command in the zone and use his offspeed stuff more effectively, then maybe he can reach his ceiling as a true late-inning, high-leverage reliever. Until that time, he'll continue to be more effective in the sixth- and seventh innings than he will with the game on the line in the eighth- and even ninth inning. (Dustin Nosler)","Baez is truly an enigma. He has the stuff and talent to be a great reliever, but he hasn't been able to put it all together at the same time. And time virtually stopped when he was on the mound thanks to confusion behind "slow the game down." Still, he has a lot of talent and stuff to always be at least intriguing on the fantasy landscape."," Baez (thumb) is scheduled to throw a bullpen session Friday before throwing again Sunday, Eric Stephen of True Blue LA reports. (3/24/2017)"
"Adam Liberatore","10637","Liberatore was one of the first players Andrew Friedman acquired after taking over the Dodgers. He wasn't the main piece of the deal with the Rays (that was Joel Peralta), but there was a reason Liberatore was wanted despite being a career minor-leaguer to that point. He had a decent debut season with LA, but his sophomore season was even better. It was highlighted by a scoreless appearance streak of 28 games. His walk rate could use improving, but his strikeout rate was plenty good for a middle reliever-type. He did suffer an injury to his left elbow that landed him on the disabled list and, ultimately, in the operating room to remove a debridement just before the postseason got underway. He may have been pitching over his head a bit early on, but Liberatore is the type of guy all bullpens need. He won't provide a lot of fantasy value, but if manager Dave Roberts needs to get the final out and a tough lefty is at the plate (and Kenley Jansen is unavailable), perhaps Liberatore is the guy he'll turn to. (Dustin Nosler)","A 28-game scoreless streak helped Liberatore to hold a sub-1 ERA until late-July. Regression hit him really hard to the tune of a 13.03 ERA in his final 16 appearances. An elbow injury ended his season early, but he should be the No. 2 lefty out of the Dodger bullpen in 2017."," Liberatore held the Diamondbacks scoreless while striking out two batters in his lone inning of work Friday. (3/25/2017)"
"Aaron Barrett","11243","Barrett underwent Tommy John surgery in September. He had ankle surgery as well in December and will try to pitch at the end of 2016. He attributed his TJS in part to overuse, telling Chelsea Janes of the Washington Post in December that pitching in 30 of the first 60 games, on top of warming up in maybe 15 others, took a toll.(Darren Schienbein)","N/A"," Barrett (elbow) cleared waivers Wednesday and declined an assignment to Triple-A Syracuse, making him a free agent, The Washington Post reports. (10/27/2016)"
"Justin Grimm","11720","Justin Grimm had an interesting 2016. For one, he heavily changed his pitch usage. He ditched his slider almost entirely, dropping his fastball usage to only 48.7% of the time, instead heavily utilizing a curveball that consumed the remainder of his usage. The results, though, were still somewhat similar to what he'd turned in before. He probably pitched better than his 4.10 ERA would indicate, with a FIP that finished at 3.28. His strikeout numbers remained favorable, with 11.11 strikeouts per nine, and while his walks did drop, his 3.93 walks per nine was still among the higher figures as far as relief pitchers go. Something worth noting is that his ground ball rate dropped for a third consecutive year, coming in at 41.5%. There were some signs of him being overworked, and that may be one of them. There were some months intermixed where his walks jumped and opposing hitters made stronger contact, factors which also lend themselves to that idea. With what the Cubs have established in their bullpen, it's likely unreasonable to expect Grimm to assume anything other than a role as a middle reliever, a situation in which his arsenal and performance over the last couple of seasons should indicate success. (Randy Holt)","Despite some stretches where he might've been overworked, Justin Grimm turned in another overall solid year out of the bullpen. While his ground ball rate and walk numbers could stand to improve, his fastball/curveball combination should help him to continue to be an effective middle relief option."," Grimm and the Cubs avoided arbitration Friday with a one-year, $1.825 million deal, Jon Heyman of Today's Knuckleball reports. (1/13/2017)"
"Will Harris","3192","If you are reading this profile, you are either intrigued by this 31-year-old's sub-two ERA in 2015 or he the fact that he was getting mentioned as an option in the Astros' closer role in the case of a Ken Giles injury. Either way, be prepared to be unimpressed. His 1.90 ERA was the only great aspect of his 2015 season. His ERA estimators point to a low to mid-three's ERA which is in line with his career 3.28 ERA. He did have an extremely low .192 batting average on balls in play and an 87% strand rate last year, both of which should regress toward league averages and cost him in the ERA category. Among qualified relievers, his 16.7% strikeout minus walk rate ranked 55th in 2015. It is not a horrible value, but his lack of elite level strikeouts (projected at 8.9 strikeouts per nine) makes him unrosterable in most leagues. The only possibility for him to gain value is to fall into a closer role after injury now. With Houston's addition of Ken Giles, his chances are about zero otherwise. (Jeff Zimmerman)","Will Harris started the offseason with a chance of being the Astros' closer, but that dream died when the Astros traded for Ken Giles. Additionally, he really lacks the tools to even be a play in leagues that count holds."," Harris (groin) pitched a perfect inning of relief in his first game back from injury Wednesday. (3/8/2017)"
"Aaron Nola","16149","In the coming era of high-spin, riding four-seam fastballs, Nola will be a throwback. His sinker has below-average spin and great sink as a result. Only Charlie Morton and Marcus Stroman got more drop on their two-seamers last year. Then you add in the curve, which stood out because only Sonny Gray threw a curve with more horizontal movement (if you count Corey Kluber's pitch as a slider). The change is comfortably Nola's worst pitch, but it also got more drop last year than any other change thrown by a starter, and only a pair of sidearmers were ahead of him on that list at all. At barely over 90 mph, Nola does have something going against him. Oh, that and injury, since a poor stretch last year led right into an early exit due to elbow soreness. But plus command and plus movement on a three-pitch arsenal should be enough to make him as good as his peripherals suggested he should be last year. If he's healthy, expect numbers commensurate with a fantasy number two. Any increase in velocity could push him to ace status. (Eno Sarris)","He doesn't throw hard, and his ball-in-play results last year covered up strong peripherals. If that makes Nola cheaper than a fantasy two or three next year, jump at the chance to buy into a surplus suggested by both his projections as well as his stuff."," Manager Pete Mackanin was happy with Nola's outing Friday despite it being a subpar performance for the young right-hander, Jim Salisbury of CSN Philadelphia reports. "He threw a lot of good changeups," Mackanin said. "And the velocity was important to me. The command will come next. Once he gets to the point where he's commanding his pitches, he's going to be back to where he's supposed to be." (3/18/2017)"
"Joe Kelly","9761","I wish I could find the Tweet. It was a Joe Kelly GIF with a comment praising his "stuff" - except the GIF depicted him brutally missing three straight spots by a combined several feet. A so-called "live arm," his average fastball velocity has generally trailed only Yordano Ventura and Nathan Eovaldi among starting(-ish) pitchers. For years, Kelly's results failed to match the stuff, given his heavy reliance on a suboptimal sinker. He replaced it with a traditional four-seamer - a pitch with twice the whiffs but also twice the home run problem. His primary off-speed pitch, his slider, remains an even more volatile feast-or-famine offering as well, inducing the most whiffs in his repertoire but also the highest isolated power (ISO). These issues and his poor control keep him perpetually at arm's length from proper success. You'd think a permanent move to the bullpen beckons him; indeed, his K%-BB% almost quadrupled upon transitioning last season. (Dave Dombrowski alluded to the idea of using him as a swingman, for better or for worse.) Such a move would make Kelly potentially more valuable to the Red Sox but decidedly less valuable to your fantasy team. He's not worth consideration in all but the deepest formats. (Alex Chamberlain)","Whether he serves as a swingman or full-time reliever, Kelly likely won't serve much purpose for fantasy teams, regardless of his role or level of success. Unless you're a sad Red Sox fan, he's not worth your consideration."," Kelly will be Boston's primary setup man if Tyler Thornburg (arm) is not ready by the regular season, Peter Abraham of The Boston Globe reports. (3/18/2017)"
"Luke Gregerson","4090","Luke Gregerson had a pretty stellar 2015 campaign, but struggled enough down the stretch and in the postseason that the Astros felt forced to sell a part of the farm and acquire closer Ken Giles from Philadelphia. Gregerson saw his strikeout and walk numbers improve over recent years, and he was fairly successful in doing what Houston asked of him -- saving 31 games. Now that his job has been taken from him, his saves are expected to plummet while his holds total goes up. He's still a very effective pitcher and would certainly be the first in line to close again should Giles struggle or become injured. His ERA saw a bit of a spike in 2015, though his peripheral numbers were quite strong. This could very well be chalked up to luck or to an Astros infield that struggled at times to convert routine plays. He should continue to provide a good number of strikeouts in 2016 and seems like a solid handcuff as he's still pitching for an Astros team that is expected to continue competing in the harsh American League West. (David Temple)","Gregerson will most likely be stripped of his closing duties in 2016, but should still be considered an asset in any league that puts value into holds, strikeouts, or thin goatees."," Gregerson worked a perfect ninth inning to pick up his second save for Team USA in Saturday's win over Team Dominican Republic in the World Baseball Classic. (3/19/2017)"
"Miguel Socolovich","6697","N/A","N/A"," Socolovich will open the season in the Cardinals' bullpen, MLB.com's Jenifer Langosch reports. (3/25/2017)"
"Blake Treinen","12572","Zach Britton. Blake Treinen. Sam Dyson. These are the super-sinkers in baseball -- all three have similar velocity and drop that are unmatched by other throwers out there. Treinen found his by accident -- a grips ball with finger placement advice on it plus a childhood injury that robbed the Nationals' righty of movement in his thumb ligament combined to produce his version -- but Treinen's superpitch is no worse than those of the other two relievers. The depth charts (right now at least) say that Treinen is second in command to Shawn Kelley in Washington's pen. By the time you read this, they may have even found another closer that should shoulder the major load at the back end of the Nats pen. But don't despair if you're a Treinen guy. Like it turned out with Dyson and Britton before him, the highest floor and decent ceiling that a super-sinker closer provides might be just the right fit for his manager's acid reflux problems. Treinen won't give up homers, even if managers in the past have preferred pitchers that didn't allow balls in play. One-dollar the 28-year-old, put him on your bench, file the name away for later: Treinen has an elite pitch and is part of a bullpen in upheaval. That's the sort of thing you have to look for. (Eno Sarris)","Opportunity and talent. Treinen has the first because the Washington Nationals didn't sign a big-name closer in the offseason. Even if they trade for one at some point, Treinen has the second because he has one of the three-best sinkers in the game. That's enough to bet on."," Nationals manager Dusty Baker said Saturday the team has decided on a closer, although he isn't yet willing to make that decision public, Chelsea Janes of the Washington Post reports. Treinen is one of three candidates for the job, along with Shawn Kelley and Koda Glover. (3/26/2017)"
"Steven Okert","13580","N/A","N/A"," With Will Smith's (elbow) status for Opening Day in question, Okert's chances of making the cut increase. (3/21/2017)"
"Boone Logan","5525","In 2014, Boone Logan allowed more than one-third of the fly balls hit against him to travel over the wall for a home run. Since we started tracking home runs per fly ball in 2002, only one player out of 3,617 had allowed a worse HR/FB% than Logan (Kameron Loe, 2013, 37.5%). As you can imagine, this wasn't what the Rockies were expecting when they signed Logan to a three-year contract, and it perfectly exhibits why three-year contracts for non-elite relievers are usually a bad idea. Logan would come back from his injuries/shame in 2015 and put together a decent little season, but it wasn't anything special, and he also got hurt again. That it was another elbow injury wasn't great news either, but he pitched well in September when he came back.  He'll remain the Rockies top lefty, but given their imports this offseason (Jason Motte, Chad Qualls) and their potentially exciting young players in the mix (Jairo Diaz, Miguel Castro), it's incredibly unlikely that Logan will see any save opportunities. Last year he only pitched 35.1 innings in 60 outings, and that probably won't change this year. He did manage 23 holds though, so if that's a thing you need, he could be a decent option in that regard. Otherwise, you should make like that other Logan, and run far away from Boone. (Paul Swydan)","Boone Logan got back to resembling a major league pitcher in 2015, but the fact that he will remain the Rockies' most prominent left-handed reliever speaks more poorly of the Rockies than it does speak well of Boone Logan."," Discounting his spring debut, Logan has allowed just one run while striking out eight hitters in his last six Cactus League appearances (5.2 innings). (3/22/2017)"
