"Mitch Haniger","14274","Mitch Haniger wasn't the highest profile player in the five-player swap between Arizona and Seattle early in the offseason, but he's an intriguing piece in the Seattle outfield moving forward. He was nothing short of dominant at the Triple-A level, with a 12.5% walk rate and .330 isolated power that went along with a .428 on-base percentage. That combination of power and on-base skills seemed to be consistent across the minor league ranks, even if there were only flashes of it with the Diamondbacks in 2016. His strikeout rate was a touch higher and walk rate a bit lower in his first exposure to the level. He did hit into a lot of bad luck, with a .256 batting average on balls in play, despite a high rate of hard contact. That major league stint also featured an isolated power of .174, an encouraging figure even if he only reached base at a .308 clip. Nonetheless, the power potential is there. There's also a small bit of upside on the base paths, with 12 swipes between Double-A and Triple-A in 2016. He probably presents more offensive upside than many of the other outfield options in Seattle with that combination of power and approach. As such, that's definitely a situation worth monitoring as the team moves closer into the spring. (Randy Holt)","After dominating a pair of minor league levels in 2016, Mitch Haniger made his first major league appearance in 2016. While he ran into some bad luck, between the power and on-base skills he demonstrated across his minor league career, he should be in good shape, and receive an opportunity to contribute early in 2017."," Haniger, who's now slashing .406/.472/.719 over 32 spring at-bats, is drawing high praise from manager Scott Servais, Greg Johns of MLB.com reports. "His approach and how he goes about his business, he's as prepared as any young player I've seen in a long time," Servais said. "He's very disciplined, when he goes to the cage, how he takes his batting practice, what he does in his pregame. It's paying off." (3/14/2017)"
"Mac Williamson","14158","The Giants appear set to employ an inexperienced platoon of Williamson and Jarrett Parker in 2017. After a strong start to his pro career in which he hit for both average and power the 26-year-old outfielder has seen his strikeout rate spike in recent years while his average has dropped. He still hits with power and compensates for the diminished contact rate by walking a fair bit. Still, his 28% strikeout rate from 2016 does not bode well for '17. If we dissect his major league numbers, we discover that he actually hit better against right-handed pitchers but produced more power against lefties. His home/road splits were also startling. His OPS at home was .419 while on the road it was 1.061 a small sample but a Grand-Canyon-like gap. Unless there is some unknown evil force at work here, those numbers will likely iron themselves out. Even though Williamson doesn't have a huge ceiling, he could produce about league-average offence for the Giants in 2017, but his value to fantasy managers may hinge on how many at-bats he earns versus Parker. Monitor the Giants' left field situation in the spring and if Williamson appears set to receive the bulk of playing time he could be a low-cost, late-round option. (Marc Hulet)","Williamson is likely to produce a low average while piling up strikeouts but he'll also give you power numbers and walk a fair bit. If he gets the bulk of playing time in left field for the Giants over Jarrett Parker then he just might be worth a late-round pick."," Williamson (quadriceps) was held out of action this weekend after his quad tightened up, CSN Bay Area reports. (3/20/2017)"
"Rickie Weeks Jr.","1849","After a season in which he notched only 95 plate appearances for the Seattle Mariners, Rickie Weeks Jr. managed to appear in 108 games with the Arizona Diamondbacks in 2016. The notable difference between the two seasons was that Weeks was actually able to provide positive offensive value for Arizona in 2016. Where the improvement really came through for Weeks was in his batting average on balls in play, which jumped from .211 in 2015 to .288 in 2016. It certainly helped that he was able to make hard contact about 40% of the time, a mark far better than the paltry 16.9 Hard% that he posted the previous season. Interestingly enough, though, his swing and contact rates remained extremely similar to his previous season. His strikeout and walk rates across the two seasons were almost identical, with 26.3% K-rates in each of the two seasons, and a 9.8% walk rate in 2016 that was 0.3% higher than the previous season. While his offensive value did fall on the positive side, it may not have been significant enough to earn him a job for next year, with low power numbers and a high strikeout rate. It's a murky picture for him moving forward. (Randy Holt)","After a season in which he was cut by the Seattle Mariners, Rickie Weeks was able to provide some decent value for the Arizona Diamondbacks as a bench piece. Although with the high strikeout numbers, it's difficult to see Weeks with a job by next spring."," Weeks went 2-for-3 with a two-run double, solo home run and two runs in Tuesday's 10-6 Grapefruit League split-squad victory over the Yankees. (3/15/2017)"
"Tommy Pham","2967","Tommy Pham made it one plate appearance into the 2016 season before injuring himself, and thus has been the plight of Tommy Pham. His minor league career has been lengthy due to multiple injuries slowing down his development. One of those physical issues was an eye condition that it made it difficult for him to see, but he had that issue corrected and eventually made the majors with a decent shot at playing time back in 2015. He played fairly well that season, showing some pop and the potential for some steals, but couldn't seem to get everyday time. He was then injured to begin 2016 and his playing time when he returned was not plentiful. He got into nearly half of the games, but many of those were late-game defensive replacements and he got under 200 plate appearances. He showed some power, hitting nine home runs and adding a couple steals, but also struck out nearly 40% of the time, limiting his batting average and offensive capabilities. The Cardinals signed Dexter Fowler to play center, have Stephen Piscotty entrenched in right and appear fully committed to Randal Grichuk in left. Absent an injury, the now 29-year-old Pham, doesn't have a real shot at decent playing time, and even if he does, he has not shown he can stay healthy and effective for any length of time. (Craig Edwards)","Tommy Pham is talented with power and speed, but a lack of playing time, an inability to stay healthy, and major concerns with strikeouts will keep him on the bench for most of 2017."," Pham exited Friday's game after sustaining a lip laceration while sliding into second, Jenifer Langosch of MLB.com reports. (3/17/2017)"
"Desmond Jennings","1965","Jennings was ranked no worse than 80th in Baseball America's Top 100 prospect list each year from 2008-11. The folks at Baseball Prospectus were more bullish on him, as they ranked him in the Top 50 each of those four years. Jennings was slow-baked in the minors due to injury and cost-control measures and did not get a full-time role until his age-24 season. The hype and promise of his minor league career has not fully materialized in his major league career. Before leg issues derailed much of the past two seasons, he was a league-average offensive player who struggled against righties, especially those with good velocity that worked up in the zone. Jennings has been rather public with his displeasure of playing on synthetic surfaces, so his new home on soft grass may help his legs get back to health and get him running again. Now with Cincinnati, he could rebuild his career if used on the short side of a platoon and as a defensive specialist. It is not often a former prospect of his caliber is at a career crossroads at age 30, but that is where Jennings is at. (Jason Collette)","Jennings has lost the last two seasons to leg issues, which may have been worsened by playing on the synthetic surface at Tropicana Field. When a speed guy loses his legs, everything else falls apart, as it has for him over the past two years. Thirty-year-old speedsters with bad wheels are not exactly a market inefficiency to exploit."," Jennings (knee) has started spring training by going 2-for-5 in his first two games. (2/28/2017)"
"Adam Duvall","10950","Duvall didn't open the season as an every day starter, but it didn't take long for him to wrangle away the left field job all to himself. He rewarded the Reds with immense power production, but a fly ball heavy approach that killed his BABIP, along with a weak walk rate, meant that his OBP hovered in unacceptable territory. It's a good thing he played excellent defense, because this looks like a risky offensive skill set to rely on. The power is most certainly for real and there's probably a bit more upside than downside to that BABIP. It would be smart to assume some regression, but there's seemingly a slightly higher level Duvall could reach if his HR/FB rate inches up to 20% and BABIP approaches the league average. That's not asking a whole lot and it would put him into the 35-40 homer, .260 batting average club, which doesn't enjoy a large membership. (","Power, power, and more power is Duvall's game and because of his extreme fly ball tendency, he didn't require a massive HR/FB rate to exceed 30 homers. That means that further upside isn't impossible to imagine."," Duvall is slated to hit cleanup in manager Bryan Price's Opening Day lineup, John Fay of the Cincinnati Enquirer reports. (2/17/2017)"
"Danny Valencia","6364","Valencia impressed with Oakland in 2015 after arriving in August via waivers, posting an .886 OPS in 47 games and earning a starting role the next year. With a full-time opportunity for the first time since 2011, Valencia responded with a .solid .287/.346/.446 batting line and 17 home runs while playing mostly third base and right field. He was especially effective against left-handed pitching, mashing them to the tune of a .924 OPS against southpaws vs. a still-respectable .742 mark against righties. It is worth noting that Valencia, like most of the Oakland batters, performed much better when away from the Coliseum. Despite his solid campaign overall, Valencia found himself traded to Seattle in the offseason, likely in part because of his raising arbitration costs and in part because of a well-publicized clubhouse scuffle with Billy Butler. Looking ahead to 2017, the 32-year-old will have plenty of opportunities to find playing time in the Mariners lineup against southpaws and could find time versus righties if Dan Vogelbach isn't quite ready for primetime, making him worth a look near the end of drafts. (Dylan Higgins)","Valencia picked up where he left off in 2015, mashing left-handers and proving he is capable of contributing in an everyday role with some position flexibility for Oakland last year. The veteran will now suit up for Seattle, and although it is unclear where he will spend most of his time in the field, he should be able to once again contribute double-digit homers and help out on most fantasy squads."," Valencia went 1-for-2 with a double, two walks and two runs in Sunday's 13-2 Cactus League win over the Padres. (2/26/2017)"
"Shane Peterson","7423","There Brewers are in the middle of a transition to rebuilding, but even following their in-season trade of Carlos Gomez to the Astros, their outfield is surprisingly set. Ryan Braun and Khris Davis are both established in the corner spots, and 23-year-old trade returnee Domingo Santana is the logical candidate to play center field for a team unlikely to be competitive in 2016. That leaves Shane Peterson likely in a utility role for the Brewers next season. Overall, Peterson would provide a decent average with little pop or speed in extended playing time, and as a left-handed hitter, he could complement the all-right-handed starting outfield. However, the team also acquired left-handed Kirk Nieuwenhuis off waivers this offseason, and despite lesser contact ability, power, speed, and defense all favor Nieuwenhuis for the fourth outfielder role over Peterson. Things could still potentially change for Peterson if the Brewers trade a player like Davis to continue their rebuild, but Peterson would not be much of a fantasy asset even if he were an everyday player.","With the Brewers in a rebuild, expect them to give their available outfield playing time to prospects like Domingo Santana rather than Shane Peterson. If Peterson does find the field, he offers moderate contact ability with no power or speed to speak of. Look elsewhere in fantasy."," Peterson went 1-for-2 with a two-run home run in Monday's 9-4 Grapefruit League loss to the Twins. (3/14/2017)"
"Jay Bruce","9892","Jay Bruce saw an uptick in his power up the middle in 2016, relying less on his pure pull power and knocking 8 home runs over the center field fence and 3 to left field up from 5 and 1 respectively last season. This change is modest, all being considered, but it represents a dramatic departure from his diminished performance in recent years. Prior to his knee injury in 2014, Bruce would regularly drive 35% of his home runs to center and left field, peaking at 47% in 2013. In 2014 he didn't hit a single home run to left or center after the month of June and this rate dipped to 22%, rebounded to 26% in 2015, and it is now back to 33%. This could be a sign that he has returned to pre-injury form. In 2015 he set a career best in Contact%, which remained roughly constant in 2016 with a slightly reduced strikeout rate (21%). Worryingly, his walk rate dipped to 7.5%, nearly a career low and significantly lower than the 10% we saw from him during his best years. Jay Bruce will have to battle for playing time in the crowded Mets outfield, but he remains a consistent power threat and run producer. (Andrew Perpetua)","For the first time since 2013, Jay Bruce appears to be playing unhindered and at full health. If he is a full time player, he is a lock for 25-30 home runs, but at the moment, with this crowded Mets outfield, he may lose a few at bats to other players."," Bruce (hip) will likely return to the lineup Wednesday, Newsday reports. (3/20/2017)"
"Torii Hunter","731","Torii Hunter has twice as many i's in his first name as he does years left in the majors. This is a clumsy way of saying that he's retired and you don't want to put him on your team. (David Temple)","Torii Hunter's production could fall off at any point, but it hasn't. Value him correctly and look to pick him up at a discount."," Hunter has retired from baseball, the Minneapolis Star Tribune reports. (10/26/2015)"
"Aaron Hicks","5297","After a breakout age-25 season in 2015,Hicks came crashing back to earth last year and returned to his light-hitting ways. The tools that made Hicks the fourteenth overall pick are still largely intact: he runs well, puts a charge into the ball and has a cannon for an arm. He's even improved his approach since his early days in Minnesota. But eight years after draft day, he's yet to put it all together for any extended period. He got a bit unlucky on balls in play last year, so he's bound to improve on his 2016 stat line. Still, expecting him to even replicate his 2015 numbers is probably a stretch, especially since he won't be playing every day in New York. Even Hicks' best-case scenario low double-digit homers and steals with a poor average has little value in standard mixed leagues. At best, he's a tools-based upside play in AL-only, but there are surely younger toolsy outfielders who fit that mold. ","Hicks has impressive tools, but he's yet to put it all together for any extended period. Now 27, the odds of him developing into a viable mixed league outfielder aren't great."," Hicks agreed to a one-year deal with the Yankees on Friday, avoiding arbitration. (1/13/2017)"
"Andrew Toles","13414","A former third-round pick of the Rays, Toles disappeared from baseball after maturity issues haunted him throughout his early career. He gained a second chance with the Dodgers and made the most of it. Despite having no prior experience above A-ball, Toles played at three minor league levels last year and reached the majors in early July. Along the way, he showed the ability to hit for a high average with extra-base pop and a solid eye at the plate. The 24-year-old also has solid defensive skills in center field. He stole more than 60 bases early in his career and could nab 30+ for the Dodgers to go along with a high average. His biggest needs will be to trim down on his strikeout rate (22%) and gain more experience against southpaws to prove that he can play every day. Just 13 of his 105 at-bats in the majors came against left-handers. He doesn't currently have a platoon partner as both Andre Ethier and Joc Pederson also swing from the left side. The club could possibly look to deal (or cut) Ethier and pair Toles up with another inexperienced hitter in Trayce Thompson. Uncertain playing time is really the biggest concern when considering if/when to draft Toles for your fantasy squad in '17, but spring training should help clear things up. He has a chance to be a real under-the-radar contributor if he receives enough playing time. (Marc Hulet)","Toles has just over 100 big league at-bats but he showed an advanced hit tool and has speed to spare. Those elements combine to make an intriguing sleeper for the 2017 season if the freshman hitter can break through into the veteran-heavy lineup."," Toles went 3-for-4 with a triple, an RBI and a trio of runs scored in Wednesday's spring training win over the Mariners. (3/16/2017)"
"J.T. Realmuto","11739","Unless you believe that Gary Sanchez will continue to hit home runs at the torrid pace he did over the second half of 2016, it's difficult to make much of a fantasy impact at catcher. But J.T. Realmuto provides one thing that pretty much no one else at his position can boast: stolen bases. With 12 steals in 2016, Realmuto doubled the closest catchers to him. His .303 batting average was likely inflated by upward of 40 points by an unsustainable .357 batting average on balls in play, but even .260 with double digit home runs and steals makes Realmuto one of the best fantasy options at a thin position. Moreover, Realmuto is still young at 25 years old and has proven himself one of the most durable players at his position with 263 games played over the last two seasons. Sanchez and Willson Contreras have disrupted the status quo at the position, but Realmuto's consistency and rare speed should keep him in the top five at the position. He may not make the statistical impact Buster Posey does that earns him a spot in the overall top 100, but Realmuto is one of the very few options at the position that you can draft and not worry about your production at the position. (Scott Spratt)","J.T. Realmuto does not produce gaudy statistics, but his combination of a solid batting average, moderate power, and surprising speed make him one of the best fantasy options at catcher."," Realmuto is expected to see some action at first base in 2017, The South Florida Sun-Sentinel reports. (2/13/2017)"
"Mark Teixeira","1281","After a down year in 2014, Mark Teixeira seemed to be on the way to a solid rebound last year. The veteran slugger flashed plenty of power and was named to the All-Star team for the first time since '09, but he fouled a ball off his leg in August and eventually ended his season early because of the resulting bone bruise. Overall, the Maryland native hit .255/.357/.548 with 31 homers in 111 games and 462 trips to the plate, good for a 147 park and league adjusted OPS that was his highest mark since '08. Teixeira was especially patient at the plate, as his 12.8% walk rate was his best mark since '10 and his 18.4% strikeout rate his lowest since '12. However, his remarkable 23.5% home run per fly ball rate was not only easily a career high but is surely likely to regress towards his lifetime 18.3% mark. Additionally, Teixeira certainly seems to have slipped a bit on defense after a long held reputation for stellar glove work. Even if that wasn't just a one year blip, his powerful bat should no doubt to continue to keep him in the lineup as long as he is healthy. Teixeira will turn 36 in April and may have played a bit over his head last year, but there is clearly still plenty of power potential for fantasy owners to tap into -- especially with Greg Bird taking the year off with his labrum injury. (Dylan Higgins)","Teixeira showed he still had plenty left in the tank last year, but he was eventually shelved due to injury and has not played in more than 123 games since 2011. The veteran slugger is still a fantasy asset in all formats due to his power, but his average is uninspiring nowadays and he can't be expected to stay in the lineup all year."," Teixeira went 1-for-3 with a walk-off grand slam in a 5-3 victory over the Red Sox on Wednesday. (9/28/2016)"
"Jake Smolinski","5408","Smolinski is known for one big skill: his ability to mash left-handed pitching. The right-handed slugger owns an impressive .290/.361/.505 line in 238 plate appearances against southpaws in his career, and even if he was not quite that sparkling in 2016, he still managed a .796 OPS against them. Smolinski also racked up a career high in playing time last year, but that added time in the lineup also meant more time facing righties, which dragged his overall line down to .238/.299/.345. Smolinski is headed into his age-28 season, and he could be in line for his share of playing time in a flexible Athletics lineup considering he can fit into all three outfield positions. That said, his lack of a consistent starting role, weak side of a platoon, and lack of substantial power or any speed means his fantasy value is limited to deep formats at best, if not only daily leagues against weak-to-medium southpaws. (Dylan Higgins)","With the ability to mash lefties and play all three outfield positions, Smolinski has what it takes to fill a solid fourth outfielder role for Oakland, especially considering his age. As far as fantasy squads are concerned, however, this limits him to deep formats for now -- although he certainly gets a bit of a bump in leagues that allow daily roster moves."," Smolinski underwent successful surgery on his right shoulder Thursday, which involved repairing his labrum and a bursectomy. (3/17/2017)"
"Nori Aoki","13075","Aoki's rookie season way back in 2010 was a revelation. Double-digit power and 30 steals to go with serviceable walks and a microscopic strikeout rate plays in all leagues. In the seasons that'd follow, he'd manage to improve upon his plate discipline, striking out even less at the expense of his power. More importantly, this past season at 34 years old, Aoki stole just seven bases, marking the fourth consecutive year his stolen-base total dropped. Now with the Astros, Aoki appears destined to cement himself a part-time player, though having come to the plate fewer than 500 times in consecutive seasons, he may have already done so. So long as the Astros' corner outfield bats stay healthy, there's no real fantasy value here anymore. (Rylan Edwards)","Aoki is a part-time player who, at best, represents a platoon bat in case of injury. His once promising career has certainly fizzled."," Aoki played in the Astros' first two spring-training games and will now depart camp to participate in the World Baseball Classic for Team Japan, Jake Kaplan of the Houston Chronicle reports. (2/27/2017)"
"Justin Smoak","9054","The Blue Jays acquired the switch-hitting Smoak prior to the 2015. The former top Rangers prospect was once the headline piece in a trade for Cliff Lee. Now 29, he's very officially a bust. Despite disappointing us all, Smoak is still a passable major league player. The Jays hid him from left-handed pitchers due to substantial career-long power splits. Smoak actually performed well versus southpaws last year, but it was a tiny 40 plate appearance sample. He appears primed to form another first base platoon with Chris Colabello and Edwin Encarnacion. He's not a world beater, but he can tap into decent power. Just don't expect anything else. (Brad Johnson)","I feel as though it's my job to make a Smoak pun. I'm resisting the urge. I swear. I am. I will say this about Smoak though. Last season, when the switch-hitter faced left-handed pitching, he smoked them (oh no...)."," Smoak went 0-for-2 with a walk and scored a run in Monday's exhibition game against the Red Sox. (3/13/2017)"
"Daniel Dorn","1050","Dorn, no relation to Roger, made his major league debut in 2015 as a 30-year-old with the Diamondbacks. In all but three of his 32 games played, he was a pinch-hitter. There wasn't much to get excited about, as he went just 5-for-30 with a double and three RBIs in his first taste of big league ball. Instead, he spent a lot of his season in Reno for the Aces. He hit .386/.444/.618 in Triple-A. Despite that, he was placed on waivers at the end of August and claimed by the Toronto Blue Jays. He lasted just six games before the Jays designated him for assignment. As a .285/.364/.498 career hitter in the minor leagues, he's the definition of Quad-A player at this stage of his career. He is currently a free agent. (Dustin Nosler)","Dorn made his major league debut in 2015 to a .167/.219/.200 triple slash. He hit .374/.430/.595 in 329 plate appearances at Triple-A."," Dorn was claimed off waivers by the Blue Jays on Friday, Fanragsports.com's Jack Magruder reports. (8/28/2015)"
"Louis Voit","sa502753","N/A","N/A","N/A"
"Jose Martinez","7996","N/A","N/A","N/A"
