"Mike Trout","10155","When you're the best fish in the sea, there's only so much still to be learned. Interesting tidbits from his 2016 performance -- he's a serious stolen base threat again, his plate patience has reached elite levels (he finished second in baseball in unintentional walk rate), and his Hard% has now climbed every single season he has played. Oh, and he's still just 25. WHAT?! He stole more bases in 2016 than 2014 and 2015 combined. Guess his speed hasn't deteriorated, so it's all up to him as to whether he continues to run wild. Did you know that since 2012, his SwStk% ranks 80th lowest (out of 340), but his strikeout rate is just 237th best? That's because he has been too darn patient, as he has posted the 10th lowest Swing%! Imagine if he swung more, he would put more balls in play, which mean more balls over the fence and maybe, just maybe, he goes 40/40. Hey, it could happen.(","Try to invent a league that rewards batters for positive baseball events and results in Trout not being the first overall pick. I dare you."," Trout went 2-for-4 with a triple and an RBI in Wednesday's win over the Reds. (3/9/2017)"
"Bryce Harper","11579","From a certain point of view, Harper's 2016 wasn't quite as bad as you may think. He was one of only nine players to turn in a 20-20 season, and his league-leading 17.3 BB% was a boon to those in OBP leagues. Still, he clearly did not perform as the #2 fantasy player many drafted him as. Rumors swirled that Harper was playing through injury or, in the words of Scott Boras, other "limitations". Regardless of their credibility, Harper had a clear drop in power from his breakout season in 2015; his HR/FB rate was cut nearly in half, from 27.3% to 14.3% (a career low), and his rate of soft-hit balls jumped from 11.9% to 19.8% (a career high). Harper also saw a 5% drop in his line-drive rate, which may have contributed to his .264 BABIP and, in turn, his .243 average. The big question, of course, is: will Harper's 2017 be more like 2015 or 2016? There's certainly cause for hope: Harper's 2016 turn as an oft-walking speedster is evidence that he'll find ways to contribute even when his power isn't on, and it can't be forgotten that he's *still* only 24 years old -- younger than Kris Bryant or Mookie Betts. Still, "2015 with a few more steals" is Harper's reasonable upside for 2017, so drafting Harper outright expecting that level of performance will likely leave you disappointed. There will probably be someone at your draft who takes Harper too high -- i.e. in the top 5 -- but if you can pick him up near the end of the first round, you may still end up with one of the two best players in fantasy come season's end. (Brice Russ)","After a breakout year in 2015, Harper took a major step back in power and average last season, though his resurgence in steals helped ease the pain a bit. Harper is one of the very few players in fantasy baseball with 40/20/.320 upside, but you definitely don't want to pay for that level of production at the draft -- target him near the end of the first if you can."," Harper went 1-for-3 with his sixth home run of the spring, a solo shot, in Thursday's Grapefruit League game against the Mets. (3/17/2017)"
"Miguel Cabrera","1744","The only concern was his health. Well, the power, too, but mostly the health. At 32 years old, the man-myth-legend who averaged 679 plate appearances for 11 seasons finally showed the slightest bit of fragility, losing a quarter of 2015 to a strained calf. A reasonable concern, to be sure. Yet Miguel Cabrera, future Hall of Famer, quelled any lingering doubts last year by stepping to the plate as if it were scripted exactly 679 times. Irrespective of health, a trend of eroding power seemed to emerge. Yet again, he stomped out whispers of decline like a discarded cigarette. It was a classic Miggy line, an almost perfect replication of his remarkable career triple-slash. The peripherals barely budged. Entering his age-34 season, he's as good as ever. Yes, a (nearly) clean bill of health does not preclude Cabrera from future injury, nor does a baker's dozen years of offensive dominance preclude him from future decline. For some, decline sets in slowly. For others, abruptly, unannounced. Cabrera's fate could be either, and it could descend upon him as soon as next year. But that's a glass that's half empty. Fact of the matter is Miggy could make his mammoth eight-year contract not completely unpalatable. In fantasy, he's a no-brainer second-rounder, and you can make an easy argument for taking him as your first pick in deeper leagues. (Alex Chamberlain)","Cabrera rebounded to vintage-Miggy levels of production, silencing doubts about waning power or declining health. He'll be 34, and Father Time steps aside for no one, but at this point, any fading on Cabrera in drafts is pure speculation. He's locked into the first two rounds."," Cabrera (back) is expected to miss the rest of the World Baseball Classic, Bob Nightengale of USA TODAY reports. (3/17/2017)"
"Joey Votto","4314","Remember when Votto concluded the month of May with just a .213 batting average, driven by a suppressed .254 BABIP? Probably not. Because his next four months more than made up for the slow start, as he batted a crazy .378, thanks to a .409 BABIP, and finished the year generally in line with his 2015 season. Heading into his age 33 season, we would expect to find some signs of skill deterioration, but he just posted the second lowest strikeout rate of his career, the second highest HR/FB rate of his career, and continues to maintain a pristine batted ball profile chock full of line drives and absent of pop-ups. I can't believe those bonus steals will continue to come and I wouldn't bank on another 20%+ HR/FB rate. However, he remains solid as a rock with a beautiful overall set of skills.(","Feel free to stare at Votto's immaculate batted ball profile, as it drives that inflated BABIP and allows him to hit well over .300 season after season. Even heading into his age 33 season, there are no signs of decline, so he should once again be a power source and strong batting average contributor."," Votto is expected to bat third in manager Bryan Price's initial batting order, John Fay of the Cincinnati Enquirer reports. (2/17/2017)"
"Giancarlo Stanton","4949","Two data points that summarize Giancarlo Stanton's fantasy career: in his seven MLB seasons, he has averaged 41 homers per 162 games -- but in only two of those seasons has he played more than 123 games. Last year, it was a groin strain which took him out in August, though he came back for sporadic appearances near the end of the season. Even before he got hurt, though, Stanton was showing some signs of concern. Stanton continued his apparent trend of being even more aggressive at the plate, with his strikeout and walk rates remaining virtually constant, at 29.8% and 10.6%, respectively, compared to 2015. His swinging strike rate stood steady at an abnormally high 15.2%, and his overall swing rate actually increased from 45.2% to 46.2%. But Stanton's freeswinging ways didn't lead to the same boost in power that they did in 2015; Stanton's HR/FB rate fell sharply from 32.1% to 22.7%, and his hard-hit rate suffered a similar drop from 49.7% to 42.9%. Stanton's batted ball profile also took a dive -- literally -- as a good chunk of his line drives turned into grounders. Stanton's at his peak, age-wise, and he has more raw power than anyone in the game, but this still all adds up to an outfielder who might have more of a 35-.250 season in 2017 than a 45-.290 season. And that, of course, is if he stays healthy. Stanton could easily be a top-5 fantasy player if things break right, but his potential downside is too great to make him more than a mid-tier OF1 this spring. (Brice Russ)","Stanton got hurt -- again -- in 2016. More distressingly, he maintained his even-higher strikeout rates from 2015 while giving back the gains he made in game power. Few players in baseball have more potential than Giancarlo, but his downside is significant enough to make him a risky pick as more than a borderline second/third round player."," Stanton crushed a mammoth, game-winning two-run home run in the fourth inning of Team USA's 6-3 victory Saturday over the Dominican Republic. (3/19/2017)"
"Anthony Rizzo","3473","Anthony Rizzo has spent the last three seasons establishing himself as one of the most consistent players in all of baseball. His home run totals in the last three seasons feature marks of 32, 31, and 32. His on-base percentage has gone .386, .387, and .385 thanks, in part, to a walk rate of 11.9%, 11.1%, and 10.9%. His park-adjusted offense was 55% above league average in 2014 before falling 45% above league average in each of the last two years. His isolated power in 2016 came in at .252, representing the best mark of his career. His strikeout rate remained somewhat favorable with a 16.0% mark. Adding to the intrigue are his splits against left-handed pitching, which continued to fall in his favor. While he mashed righties, he actually struck out less against southpaws and still managed a .205 isolated power against them. His 17 steals in 2015 were likely an outlier, as he swiped only three in 2016, but he does add a bit of value as a base runner at the first base position. Overall, Rizzo represents one of the premier options at the first base position. He's a 30 homer guy with constant opportunities to knock in runs with the lineup in front of him. (Randy Holt)","Anthony Rizzo represents as consistent a force as there is, both at the first base position and in all of baseball. With an on-base percentage that has found its way around the .385 mark and over 30 home runs in each of the last three seasons, Rizzo continues to represent one of the best at first base."," Rizzo went 2-for-3 and hit his first home run of spring training in Thursday's loss to the Mariners. (3/9/2017)"
"Paul Goldschmidt","9218","For the first time in Goldschmidt's career, he posted an isolated power below .200, but kept his fantasy value high with a career-best in stolen bases with 32. Since 2012 and excluding 2014 when he got hurt, Goldschmidt has stolen at least 15 bags. Again, excluding 2014, his SB numbers have increased since 2013. Even though he lost some value with his drop in home runs, he is still a fantasy monster posting high stats in the other four major categories. It doesn't matter if you're in a batting average or on-base percentage league: he is a top tier player. His home run to fly ball percentage was the second-worst of his career, which may explain some of the drop in his home run output. A 19% mark is only .7% less than his career rate, yet this was 3% lower than his 2015 mark (22%) when he hit 33 home runs. Add in the fact that his fly ball rate in general was much less than any of his other seasons and his infield fly rate was higher than any other season, he should be back on track for at least 30 home runs if he is able to normalize those numbers. (Paul Kastava)","Goldschmidt saw his home run output drop, but was able to excel in all other categories, particularly in stolen bases where he put up a career-best. His fly ball rate went down and his infield fly rate went up, which veered far from his norm. Expect his power to normalize back to his past numbers, keeping him in the upper echelon of fantasy."," Goldschmidt is looking forward to competing in the World Baseball Classic in March, the Arizona Republic reports. (2/21/2017)"
"Josh Donaldson","5038","On the surface it might not have looked as impressive, but Donaldson put together a fantastic encore performance on the heels of his 2015 AL MVP season. Donaldson dropped 20 points in slugging percentage -- thanks in part to four fewer home runs -- and drove in 24 fewer runs, but saw his numbers increase elsewhere with a career-best walk rate and still the same number of runs scored as his magical 2015 campaign. The slugging percentage drop was more than offset by the 33-point jump in OBP, which helped explain why Donaldson scored the same number of runs despite poking 20 fewer hits in 2016 than the prior season. Donaldson may be leaned on a bit more heavily in the middle of the order with the departure of Edwin Encarnacion, but there's nothing in the numbers that suggests he isn't up to the task. After three top-10 MVP finishes in a row, there's nothing to suggest a fourth isn't right around the corner. Josh Donaldson is a bad, bad man. (@Brandon_Warne)","Donaldson is the fourth man at a top-heavy position among third basemen. He's behind Kris Bryant, Nolan Arenado and Manny Machado, with each in the quartet going -- on average -- in the top-12 picks before No. 5 (Kyle Seager) comes off the board some 56 picks later. The elder statesman of that quartet is as good a bet as any, but if you miss out -- be prepared to wait!"," Donaldson (calf) will serve as the Blue Jays' DH and bat third in the order in Monday's Grapefruit League game against the Twins, John Lott of The Athletic Toronto reports. (3/20/2017)"
"Mookie Betts","13611","In 2016, Mookie Betts went from star to superstar. His numbers were the stuff of MVP campaigns, and if not for that pesky Mike Trout, he would have walked away with the honor, too. His 31 homers tied for the 26th-most in baseball. His 122 runs scored tied for the second-most with Josh Donaldson, a solitary run behind Trout. His 113 runs batted in ranked fifth. His 26 stolen bases ranked 10th. His .318 tied to rank seventh with his teammate, Dustin Pedroia. He was just one of nine players to put up a 20-20 season, and was the only one to put up a 30-20 season (Trout only hit 29 homers). To say it was a revelatory season would be a bit of an understatement. He didn't just excel in the batter's box, but also on the bases and in the field, all while adjusting to a new position. He did it all with a smile on his face, making him one of baseball's most fun and magnetic presences. Don't expect anything to change in 2017. Steamer projects his wRC+ to be 132, good for 11th-best in the game (his 135 wRC+ last year was 17th-best in the game). Charlie Blackmon, Trout and Betts are the only three players the system projects to have a 20-20 season. Given the conservative nature of projection systems, this is quite the statement. If a half-dozen picks have gone by in your draft and Betts is still on the board, don't even think twice - bet on Betts.","There's probably not much to say about Mookie Betts that you don't already know. If he isn't one of the top 10 (or even five) picks of your draft, you did it wrong."," Betts went 0-for-3 with a strikeout while batting cleanup for Boston in Wednesday's game against Tampa Bay. (3/16/2017)"
"David Ortiz","745","For the past 13 seasons, David Ortiz has hit a minimum of 23 home runs. In nine of those 13 seasons -- including the last three -- he has hit at least 30. Simply put, David Ortiz is very good at consistently hitting a lot of home runs. That isn't likely to change in his final campaign of 2016. There were plenty of whispers about whether he was done in the early going last year, but he wasn't actually that bad -- league average offense, when you're rocking a .231 batting average on balls in play, really isn't too shabby. That is especially true of Ortiz, who is one of the most shifted against hitters in all of baseball. When his BABIP reverted back to his career average of .299, his performance improved dramatically. The projections expect much of the same this year. They're a bit lower than normal, but that is to be expected, because there aren't a lot of good 40-year-old performances out there to compare to. What Ortiz is doing is quietly remarkable. Last season, he and Alex Rodriguez became just the sixth and seventh players in big league history to hit 30 or more homers in their age-39 season. Only Barry Bonds (2004) and Hank Aaron (1973) hit more homers in their age-39 seasons than did Ortiz last year. Ortiz's batting eye has never waned, and he isn't especially vulnerable to any one pitch. In fact, last year he tallied the best performance of his career against changeups, and on a rate basis that performance was fifth-best in the majors among qualified hitters. David Ortiz is 40 now, and it seems like he shouldn't be hitting this well anymore, but he is, so don't doubt it for a second. (Paul Swydan)","Since David Ortiz has announced his retirement effective at the end of the 2016 season, you might not want to draft him in dynasty formats, but if you don't mind that part of it, don't hesitate to draft him -- Big Papi has still got it."," Ortiz officially retired Tuesday, the Boston Globe reports. (11/16/2016)"
"Kris Bryant","15429","Kris Bryant's 2016 was not only a strong followup to his rookie campaign, but it was one in which he established himself as one of the premier offensive players in baseball. He maintained a solid walk rate, at 10.7%, while perhaps more importantly cutting down on his strikeouts. He lowered his strikeout rate from 30.6% in 2015 to 22.0% in 2016, and even some of the latter can be attributed to his ability to work deep into counts. The power was there, as he slugged 39 home runs and posted an isolated power figure of .262, the fourth highest in the National League. Even with a nearly 40-point drop in his batting average on balls in play, his average grew to .292, along with an on-base percentage of .385. Most notably, though, he was able to significantly improve his contact rate in his second year. His Contact% moved from 66.3% to 73.3% thanks to some small mechanical tweaks to his swing. He's also contributed 21 combined steals in the last two years, helping to establish him as an underrated presence on the base paths. The only question here is how far his offensive game can go. The approach is there. The power is there. It's all there for Kris Bryant. (Randy Holt)","Kris Bryant's sophomore campaign almost could not have gone any better. He improved his ability to make contact and cut down on strikeouts on his way to an ISO of .262, setting him up for some pretty serious attention on the fantasy side for years to come."," Bryant, who's been working on his power stroke the opposite way this spring, drilled a home run to right field in Sunday's loss to the Athletics, the Chicago Tribune reports. (3/13/2017)"
"Manny Machado","11493","Entering his fifth major league season, it feels like Machado has been around forever. Sometimes it's easy to forget that he is still only 24. Posting another season of offensive production nearly 30% above league average quickly dispelled any questions on the legitimacy of his marvelous 2015 campaign. While his 20 stolen bases from that year look like an outlier, Machado posted career highs in homers, runs, RBI, and batting average last season. Furthermore, he upped his isolated slugging by 20 points as well. All signs point to Machado being an elite fantasy asset again in 2017, but he improved upon his case by holding shortstop eligibility  (43 GS in 2016). While he spends most of his time at third, the presence of J.J. Hardy (less than 120 GP in each of the past two seasons) at short is encouraging for Machado's long-term outlook in keeper, dynasty, or Ottoneu leagues, as he likely will retain the position once again and hold dual SS/3B eligibility. Whether you play in a standard league or a more advanced Ottoneu format, Machado is worthy of the values given to the most elite players league-wide. (Joe Douglas)","Machado is the No. 1 shortstop across all formats. A high first-round pick in traditional leagues and a $50-plus player in Ottoneu, he is as safe as they come at the top of the first round. His only blemish being his lack of speed, which with any rebound will only increase his value. Plug him into your lineup and rest easy at SS (or 3B if you're so inclined)."," Machado went 2-for-4 with a solo home run in Saturday's World Baseball Classic victory over Team USA. (3/12/2017)"
"Nolan Arenado","9777","The Rockies have been around since 1993. In that time, 57 players have hit a home run for the Rockies before the end of their age-25 season. Wilin Rosario and Todd Helton hit 65 in that time. Carlos Gonzalez hit 73. Troy Tulowitzki hit 92. Nolan Arenado hit 111. That's a pretty big gap, and one he opened up by posting back-to-back 40 homer seasons. He became the first player to do this by the end of his age-25 season, and just the fourth player to do it in a Rockies uniform at any age. The last time a Rockies player turned the trick was Todd Helton in 2000-2001, back before the Rockies installed the humidor at Coors Field. All of that is a long way of saying that Arenado's power is legit, and not just a Coors Field creation. What's he's doing, few players in Rockies history have been able to do. Making Arenado even more dangerous is the fact that he nearly doubled his walk rate last season, and as such he posted career bests in OBP and wRC+. Overall, it was Arenado's best season, at 5.2 WAR, and if it wasn't quite excellent enough to merit MVP consideration, it was good enough to put him among the cream of a very thick third base crop. Steamer's 2017 wOBA projections call for a distinct top tier - Josh Donaldson (.377 wOBA), Kris Bryant (.374), Manny Machado (.372) and Arenado (.371). The next player on the list is Matt Carpenter at .352, nearly a 20-point gap. You don't need to necessarily make Arenado the first third baseman to come off the board, but definitely don't wait too long before grabbing him.","Nolan Arenado is one of the finest third basemen in all of baseball, and in a standard 5x5 format, he may be the most valuable, given his proclivity for home run hitting. Just in case you're not sure, that means you should target him early in the first round."," Arenado went 1-for-3 with a three-run home run in Team USA's victory over Team Canada on Sunday. (3/14/2017)"
"Freddie Freeman","5361","Freeman was already a solid fantasy commodity heading into 2016, but he broke out in a big way last year. The 27-year-old set career highs in home runs, isolated power, walk rate and runs scored, just to name a few. For in-depth analysis on whether Freeman's breakout is sustainable hint: it probably is check out Andrew Perpetua's ","I'm all aboard the Freddie Freeman breakout hype train, and you should be too. I wouldn't let him fall further than the sixth first baseman selected in standard drafts for 2017. He's not one of the position's truly-elite options, but he's closer than some would realize, and he's a clear step up from the first basemen behind him on draft boards (Hanley Ramirez, Jose Abreu, etc.)."," Freeman returned to camp with the Braves on Wednesday after playing for Team Canada at the WBC, The Atlanta Journal-Constitution reports. (3/16/2017)"
"Jose Bautista","1887","After declining the Jays' qualifying offer, Joey Bats found the free-agent market particularly chilling, to the point where he had to swallow his pride and take a one-year deal worth marginally more than the original tender from the team who offered it. But those are the breaks for a 36-year-old outfielder who picked a bad time to have his worst season in nearly a decade. Nearly everything went sideways for Bautista in 2016, as he played in just 116 games and hit just .234/.366/.452. For mere mortals that would be a perfectly fine offensive season, but for Mr. Bats that was a 122 wRC+ -- his worst mark since 2009, his first season in the Great White North. His iso dropped, his whiff rate spiked and a rough middle of the season -- sub-.700 OPS marks in just 18 games played between June and July -- waylaid what was otherwise a fairly typical season for Bautista. However, the slugger hit .255/.381/.467 over the season's final two months and showed almost no ill effects from the turf toe and knee issues that cost him time. At some point age is certain to creep in, but this seems to be the best situation for Bautista to rehab his value and still cash in one last time on the free-agent market. (@Brandon_Warne)","Father time is undefeated, but Bautista's rates looked good outside of a tough stretch in the middle of the season. A bounce-back season seems likely -- at least as likely as it can be for a 36-year-old."," Bautista is not in the lineup for Team Dominican Republic in Saturday's game against Team USA due to back stiffness, Marly Rivera of ESPN reports. (3/18/2017)"
"Eric Thames","3711","On YouTube, there's a ","Thames' return to the majors figures to be one of the biggest spring training stories. Will he be overmatched? Will he continue his KBO-mashing ways? Will he fall somewhere between those two scenarios? Yes, probably that last one."," Thames (knee) is batting second and playing first base during Sunday's Cactus League game against the Giants. (3/19/2017)"
